{
  "version": "1.0.0",
  "game_id": "dokdo_arc_webgame",
  "chapter_id": "CH04",
  "title": "상자들의 도시 UI 플로우",
  "entry_screen_id": "CH04_BRIEF",
  "screens": [
    {
      "screen_id": "CH04_BRIEF",
      "screen_type": "chapter_briefing",
      "title": "물류벨트 브리핑",
      "purpose": "배지 확보와 판교 진입 목표를 설명한다.",
      "widgets": [
        "objective_panel",
        "route_compare",
        "line_status"
      ],
      "data_sources": [
        "chapter_meta",
        "player_inventory"
      ],
      "primary_actions": [
        "start_mission"
      ],
      "notes": []
    },
    {
      "screen_id": "CH04_MAP",
      "screen_type": "world_map",
      "title": "물류벨트 지도",
      "purpose": "철도선과 배송터널을 한 화면에서 비교한다.",
      "widgets": [
        "node_map",
        "route_compare",
        "line_status",
        "hazard_overlay"
      ],
      "data_sources": [
        "ch04.nodes",
        "route_state",
        "player_stats"
      ],
      "primary_actions": [
        "select_node",
        "toggle_route_overlay",
        "open_inventory"
      ],
      "notes": []
    },
    {
      "screen_id": "CH04_EVENT",
      "screen_type": "event_dialogue",
      "title": "물류 이벤트",
      "purpose": "라인 재가동, 약품 배분, 보안실 침투를 처리한다.",
      "widgets": [
        "event_card",
        "choice_list",
        "npc_portrait"
      ],
      "data_sources": [
        "ch04.events",
        "player_flags",
        "reputation_state"
      ],
      "primary_actions": [
        "pick_choice",
        "back_to_map"
      ],
      "notes": []
    },
    {
      "screen_id": "CH04_SECURITY",
      "screen_type": "event_dialogue",
      "title": "배지 인증 UI",
      "purpose": "원본 회수/위조 출력 선택을 시각화한다.",
      "widgets": [
        "card_auth_state",
        "choice_list",
        "loot_preview"
      ],
      "data_sources": [
        "ch04.events",
        "player_items"
      ],
      "primary_actions": [
        "forge_badge",
        "take_original",
        "cancel"
      ],
      "notes": []
    },
    {
      "screen_id": "CH04_LOOT",
      "screen_type": "loot_resolution",
      "title": "창고/분류홀 루팅",
      "purpose": "상자형 루팅과 즉시 분류 효과를 보여준다.",
      "widgets": [
        "loot_grid",
        "capacity_meter",
        "rarity_badge"
      ],
      "data_sources": [
        "loot_table",
        "player_inventory"
      ],
      "primary_actions": [
        "take_selected",
        "take_all",
        "discard"
      ],
      "notes": []
    },
    {
      "screen_id": "CH04_BOSS_INTRO",
      "screen_type": "boss_intro",
      "title": "피커 조우",
      "purpose": "라인 가동 상태에 따른 전장 차이를 먼저 알려준다.",
      "widgets": [
        "boss_splash",
        "line_status",
        "boss_hint"
      ],
      "data_sources": [
        "boss_meta",
        "route_state"
      ],
      "primary_actions": [
        "enter_boss"
      ],
      "notes": []
    },
    {
      "screen_id": "CH04_COMBAT",
      "screen_type": "combat_arena",
      "title": "분류홀 보스전",
      "purpose": "컨베이어와 압착 지형을 포함한 산업 전투 UI.",
      "widgets": [
        "combat_hud",
        "boss_hp",
        "line_status",
        "hazard_overlay"
      ],
      "data_sources": [
        "combat_state",
        "player_stats",
        "enemy_state"
      ],
      "primary_actions": [
        "attack",
        "skill",
        "item",
        "move"
      ],
      "notes": []
    },
    {
      "screen_id": "CH04_RESULT",
      "screen_type": "result_summary",
      "title": "물류벨트 결산",
      "purpose": "배지 상태, 진입권, 열린 노선을 정리한다.",
      "widgets": [
        "chapter_result",
        "route_summary",
        "reputation_change"
      ],
      "data_sources": [
        "chapter_outcome",
        "route_state",
        "reputation_state"
      ],
      "primary_actions": [
        "confirm"
      ],
      "notes": []
    }
  ],
  "transitions": [
    {
      "from_screen_id": "CH04_BRIEF",
      "to_screen_id": "CH04_MAP",
      "trigger": "start_mission",
      "conditions": [],
      "notes": ""
    },
    {
      "from_screen_id": "CH04_MAP",
      "to_screen_id": "CH04_EVENT",
      "trigger": "select_node",
      "conditions": [
        "node.has_event=true"
      ],
      "notes": ""
    },
    {
      "from_screen_id": "CH04_EVENT",
      "to_screen_id": "CH04_SECURITY",
      "trigger": "event_id=EV_CH04_SECURITY_BADGES",
      "conditions": [],
      "notes": ""
    },
    {
      "from_screen_id": "CH04_EVENT",
      "to_screen_id": "CH04_LOOT",
      "trigger": "choice_resolved",
      "conditions": [
        "event.grants_loot=true"
      ],
      "notes": ""
    },
    {
      "from_screen_id": "CH04_EVENT",
      "to_screen_id": "CH04_BOSS_INTRO",
      "trigger": "event_id=EV_CH04_BOSS_PICKER",
      "conditions": [],
      "notes": ""
    },
    {
      "from_screen_id": "CH04_SECURITY",
      "to_screen_id": "CH04_EVENT",
      "trigger": "badge_choice_done",
      "conditions": [],
      "notes": ""
    },
    {
      "from_screen_id": "CH04_LOOT",
      "to_screen_id": "CH04_MAP",
      "trigger": "loot_closed",
      "conditions": [],
      "notes": ""
    },
    {
      "from_screen_id": "CH04_BOSS_INTRO",
      "to_screen_id": "CH04_COMBAT",
      "trigger": "enter_boss",
      "conditions": [],
      "notes": ""
    },
    {
      "from_screen_id": "CH04_COMBAT",
      "to_screen_id": "CH04_RESULT",
      "trigger": "combat_victory",
      "conditions": [
        "flag:chapter_04_escape_ready"
      ],
      "notes": ""
    },
    {
      "from_screen_id": "CH04_MAP",
      "to_screen_id": "CH04_RESULT",
      "trigger": "event_id=EV_CH04_EXTRACTION",
      "conditions": [
        "flag:chapter_04_completed"
      ],
      "notes": ""
    }
  ],
  "notes": [
    "CH04는 시스템 복구 느낌을 살리려면 라인 상태 변화가 지도와 전투에 동시에 반영돼야 한다.",
    "배지 위조 UI는 카드 프린터/인증 성공률 같은 디테일로 몰입감을 줄 수 있다."
  ]
}