{
  "version": "1.0.0",
  "game_id": "dokdo_arc_webgame",
  "chapter_id": "CH19",
  "title": "외해 전초 UI Flow",
  "entry_screen_id": "CH19_BRIEF",
  "screens": [
    {
      "screen_id": "CH19_BRIEF",
      "screen_type": "chapter_briefing",
      "title": "외해 전초 브리핑",
      "purpose": "차문식 논리와 공개 논리가 군중 앞에서 충돌한다.",
      "widgets": [
        "objective_panel",
        "platform_vote",
        "auth_stack",
        "storm_pressure"
      ],
      "data_sources": [
        "chapter_meta",
        "player_stats"
      ],
      "primary_actions": [
        "start_mission"
      ],
      "notes": [
        "visual:염분 바람, 새벽 회색, 수기 명단, 방송 장비, 공공 배급 보드"
      ]
    },
    {
      "screen_id": "CH19_HUB",
      "screen_type": "route_select",
      "title": "최종 선택",
      "purpose": "P4 전용 호흡과 선택 압박을 주는 화면.",
      "widgets": [
        "public_queue",
        "ending_matrix",
        "broadcast_prep",
        "platform_vote",
        "auth_stack",
        "storm_pressure"
      ],
      "data_sources": [
        "route_state",
        "player_flags",
        "trust_state"
      ],
      "primary_actions": [
        "confirm_route"
      ],
      "notes": [
        "motion:대기열 갱신, 방송 파형, 무거운 페이드, 선택 후 잔향"
      ]
    },
    {
      "screen_id": "CH19_MAP",
      "screen_type": "world_map",
      "title": "외해 전초 노드",
      "purpose": "외해 승선 덱 -> 등록 홀 -> 파도 차단벽 -> 독도 접근 게이트",
      "widgets": [
        "map_overlay",
        "platform_vote",
        "auth_stack"
      ],
      "data_sources": [
        "ch19.nodes",
        "player_flags"
      ],
      "primary_actions": [
        "select_node",
        "open_inventory"
      ],
      "notes": [
        "theme:outer_sea_platform_politics"
      ]
    },
    {
      "screen_id": "CH19_EVENT",
      "screen_type": "event_dialogue",
      "title": "외해 전초 이벤트",
      "purpose": "메인/사이드 선택과 텍스트 이벤트를 처리한다.",
      "widgets": [
        "event_card",
        "choice_list",
        "platform_vote",
        "auth_stack"
      ],
      "data_sources": [
        "ch19.events",
        "trust_state",
        "player_flags"
      ],
      "primary_actions": [
        "pick_choice",
        "back_to_map"
      ],
      "notes": [
        "stitch:외해 관문"
      ]
    },
    {
      "screen_id": "CH19_LOOT",
      "screen_type": "loot_resolution",
      "title": "외해 전초 루팅",
      "purpose": "사이드 퀘스트 결과와 보급 확보를 정산한다.",
      "widgets": [
        "loot_grid",
        "platform_vote"
      ],
      "data_sources": [
        "loot_table",
        "player_inventory"
      ],
      "primary_actions": [
        "take_selected",
        "discard"
      ],
      "notes": []
    },
    {
      "screen_id": "CH19_BOSS_INTRO",
      "screen_type": "boss_intro",
      "title": "외해 파고체 등장",
      "purpose": "클라이맥스 전투 규칙과 비주얼 압박을 소개한다.",
      "widgets": [
        "boss_splash",
        "platform_vote",
        "auth_stack"
      ],
      "data_sources": [
        "boss_meta",
        "player_flags"
      ],
      "primary_actions": [
        "enter_boss"
      ],
      "notes": [
        "boss:outer_wave_lord"
      ]
    },
    {
      "screen_id": "CH19_COMBAT",
      "screen_type": "combat_arena",
      "title": "외해 전초 전투",
      "purpose": "보스전과 파트별 HUD 밀도를 반영한다.",
      "widgets": [
        "combat_hud",
        "boss_hp",
        "platform_vote",
        "auth_stack"
      ],
      "data_sources": [
        "combat_state",
        "enemy_state",
        "player_stats"
      ],
      "primary_actions": [
        "attack",
        "skill",
        "item",
        "move"
      ],
      "notes": []
    },
    {
      "screen_id": "CH19_RESULT",
      "screen_type": "result_summary",
      "title": "외해 전초 결과",
      "purpose": "다음 장으로 밀려나는 결과와 Part 감정 잔향을 정리한다.",
      "widgets": [
        "chapter_result",
        "party_summary",
        "platform_vote"
      ],
      "data_sources": [
        "chapter_outcome",
        "trust_state",
        "route_state"
      ],
      "primary_actions": [
        "confirm"
      ],
      "notes": [
        "immersion:외해 관문"
      ]
    }
  ],
  "transitions": [
    {
      "from_screen_id": "CH19_BRIEF",
      "to_screen_id": "CH19_HUB",
      "trigger": "start_mission",
      "conditions": [],
      "notes": ""
    },
    {
      "from_screen_id": "CH19_HUB",
      "to_screen_id": "CH19_MAP",
      "trigger": "confirm_route",
      "conditions": [],
      "notes": "파트별 분위기 전용 허브 화면"
    },
    {
      "from_screen_id": "CH19_MAP",
      "to_screen_id": "CH19_EVENT",
      "trigger": "select_node",
      "conditions": [
        "node.has_event=true"
      ],
      "notes": ""
    },
    {
      "from_screen_id": "CH19_EVENT",
      "to_screen_id": "CH19_LOOT",
      "trigger": "choice_resolved",
      "conditions": [
        "event.grants_loot=true"
      ],
      "notes": ""
    },
    {
      "from_screen_id": "CH19_EVENT",
      "to_screen_id": "CH19_BOSS_INTRO",
      "trigger": "event_id=EV_CH19_BOSS",
      "conditions": [],
      "notes": ""
    },
    {
      "from_screen_id": "CH19_LOOT",
      "to_screen_id": "CH19_MAP",
      "trigger": "loot_closed",
      "conditions": [],
      "notes": ""
    },
    {
      "from_screen_id": "CH19_BOSS_INTRO",
      "to_screen_id": "CH19_COMBAT",
      "trigger": "enter_boss",
      "conditions": [],
      "notes": ""
    },
    {
      "from_screen_id": "CH19_COMBAT",
      "to_screen_id": "CH19_RESULT",
      "trigger": "combat_victory",
      "conditions": [
        "flag:chapter_19_completed"
      ],
      "notes": ""
    }
  ],
  "notes": [
    "part:P4",
    "visual:염분 바람, 새벽 회색, 수기 명단, 방송 장비, 공공 배급 보드",
    "motion:대기열 갱신, 방송 파형, 무거운 페이드, 선택 후 잔향",
    "stitch_theme:outer_sea_platform_politics"
  ]
}
