{   "version": "1.0.0",   "game_id": "dokdo_arc_webgame",   "chapter_id": "CH01",   "title": "잿빛 개장 UI 플로우",   "entry_screen_id": "CH01_BRIEF",   "screens": [     {       "screen_id": "CH01_BRIEF",       "screen_type": "chapter_briefing",       "title": "브리핑",       "purpose": "챕터 목표와 시작 장비를 노출한다.",       "widgets": [         "objective_panel",         "party_loadout",         "dialogue_box"       ],       "data_sources": [         "chapter_meta",         "player_inventory",         "npc_yoon_haein"       ],       "primary_actions": [         "start_mission"       ],       "notes": [         "튜토리얼 플래그를 여기서 세팅"       ]     },     {       "screen_id": "CH01_MAP",       "screen_type": "world_map",       "title": "여의도 지도",       "purpose": "노드 접근과 이동 비용을 보여준다.",       "widgets": [         "node_map",         "noise_meter",         "contamination_meter",         "route_hint"       ],       "data_sources": [         "ch01.nodes",         "player_stats"       ],       "primary_actions": [         "select_node",         "open_inventory",         "open_status"       ],       "notes": [         "튜토리얼이므로 비활성 기능을 UI에서 흐리게 처리"       ]     },     {       "screen_id": "CH01_EVENT",       "screen_type": "event_dialogue",       "title": "현장 이벤트",       "purpose": "탐색/서사 이벤트를 처리한다.",       "widgets": [         "event_card",         "choice_list",         "npc_portrait"       ],       "data_sources": [         "ch01.events",         "player_flags",         "player_items"       ],       "primary_actions": [         "pick_choice",         "back_to_map"       ],       "notes": [         "텍스트는 2~3문단 이상 길어지지 않게 분절"       ]     },     {       "screen_id": "CH01_LOOT",       "screen_type": "loot_resolution",       "title": "루팅",       "purpose": "루팅 결과와 인벤토리 압박을 처리한다.",       "widgets": [         "loot_grid",         "capacity_meter",         "compare_popup"       ],       "data_sources": [         "loot_table",         "player_inventory"       ],       "primary_actions": [         "take_all",         "take_selected",         "discard"       ],       "notes": [         "튜토리얼에선 오버웨이트 경고를 강하게 노출"       ]     },     {       "screen_id": "CH01_BOSS_INTRO",       "screen_type": "boss_intro",       "title": "편집괴 조우",       "purpose": "보스 진입 전 기믹을 안내한다.",       "widgets": [         "boss_splash",         "boss_hint",         "arena_tags"       ],       "data_sources": [         "boss_meta",         "encounter_table"       ],       "primary_actions": [         "enter_boss"       ],       "notes": [         "오디오 트랩/조명 레일 힌트를 시각적으로 강조"       ]     },     {       "screen_id": "CH01_COMBAT",       "screen_type": "combat_arena",       "title": "스튜디오 전투",       "purpose": "실시간/턴제 전투 UI 본체.",       "widgets": [         "combat_hud",         "boss_hp",         "noise_meter",         "filter_meter"       ],       "data_sources": [         "combat_state",         "player_stats",         "enemy_state"       ],       "primary_actions": [         "attack",         "skill",         "item",         "move"       ],       "notes": [         "튜토리얼용 툴팁을 1회만 노출"       ]     },     {       "screen_id": "CH01_RESULT",       "screen_type": "result_summary",       "title": "결과 정산",       "purpose": "선택 결과와 획득 플래그를 보여준다.",       "widgets": [         "chapter_result",         "trust_summary",         "loot_summary"       ],       "data_sources": [         "chapter_outcome",         "player_stats",         "trust_state"       ],       "primary_actions": [         "confirm"       ],       "notes": [         "다음 챕터 버튼은 CH02 해금 후 활성"       ]     }   ],   "transitions": [     {       "from_screen_id": "CH01_BRIEF",       "to_screen_id": "CH01_MAP",       "trigger": "start_mission",       "conditions": [],       "notes": "브리핑 종료 후 지도 진입"     },     {       "from_screen_id": "CH01_MAP",       "to_screen_id": "CH01_EVENT",       "trigger": "select_node",       "conditions": [         "node.has_event=true"       ],       "notes": "노드별 대표 이벤트 오픈"     },     {       "from_screen_id": "CH01_EVENT",       "to_screen_id": "CH01_LOOT",       "trigger": "choice_resolved",       "conditions": [         "event.grants_loot=true"       ],       "notes": "루팅 테이블이 붙은 선택지"     },     {       "from_screen_id": "CH01_EVENT",       "to_screen_id": "CH01_MAP",       "trigger": "choice_resolved",       "conditions": [         "event.complete=true",         "event.grants_loot=false"       ],       "notes": "일반 선택 종료"     },     {       "from_screen_id": "CH01_LOOT",       "to_screen_id": "CH01_MAP",       "trigger": "loot_closed",       "conditions": [],       "notes": "루팅 종료 후 노드 맵 복귀"     },     {       "from_screen_id": "CH01_EVENT",       "to_screen_id": "CH01_BOSS_INTRO",       "trigger": "event_id=EV_CH01_BOSS_BROADCAST",       "conditions": [],       "notes": "보스 직전 연출"     },     {       "from_screen_id": "CH01_BOSS_INTRO",       "to_screen_id": "CH01_COMBAT",       "trigger": "enter_boss",       "conditions": [],       "notes": "보스전 시작"     },     {       "from_screen_id": "CH01_COMBAT",       "to_screen_id": "CH01_RESULT",       "trigger": "combat_victory",       "conditions": [         "flag:chapter_01_escape_ready"       ],       "notes": "탈출 이벤트 후 결과 정산"     },     {       "from_screen_id": "CH01_COMBAT",       "to_screen_id": "CH01_MAP",       "trigger": "combat_defeat_survive",       "conditions": [],       "notes": "패배 후 맵 복귀 또는 회복"     },     {       "from_screen_id": "CH01_MAP",       "to_screen_id": "CH01_RESULT",       "trigger": "event_id=EV_CH01_EXTRACTION",       "conditions": [         "flag:chapter_01_completed"       ],       "notes": "챕터 종료"     }   ],   "notes": [     "CH01은 튜토리얼이므로 인벤토리, 소음, 오염 UI를 강제 노출한다.",     "보스전 이전엔 지도 줌을 잠시 잠가 연출 집중도를 높인다."   ] }