{
  "version": "1.0.0",
  "game_id": "dokdo_arc_webgame",
  "chapter_id": "CH13",
  "title": "백색 야적장 UI Flow",
  "entry_screen_id": "CH13_BRIEF",
  "screens": [
    {
      "screen_id": "CH13_BRIEF",
      "screen_type": "chapter_briefing",
      "title": "백색 야적장 브리핑",
      "purpose": "약과 증거, 누구를 위해 남겨진 물자인지를 판단한다.",
      "widgets": [
        "objective_panel",
        "freeze_meter",
        "evidence_balance",
        "cargo_temperature"
      ],
      "data_sources": [
        "chapter_meta",
        "player_stats"
      ],
      "primary_actions": [
        "start_mission"
      ],
      "notes": [
        "visual:푸른 응급등, 백색 서리, 철골, 넓은 음영, 구조 기록 보드"
      ]
    },
    {
      "screen_id": "CH13_HUB",
      "screen_type": "safehouse",
      "title": "격리 기지",
      "purpose": "P3 전용 호흡과 선택 압박을 주는 화면.",
      "widgets": [
        "rail_switch_map",
        "cold_exposure",
        "frequency_map",
        "freeze_meter",
        "evidence_balance",
        "cargo_temperature"
      ],
      "data_sources": [
        "route_state",
        "player_flags",
        "trust_state"
      ],
      "primary_actions": [
        "leave_safehouse"
      ],
      "notes": [
        "motion:주파수 스윕, 무거운 패널, 느린 페이드, 저온 브레스"
      ]
    },
    {
      "screen_id": "CH13_MAP",
      "screen_type": "world_map",
      "title": "백색 야적장 노드",
      "purpose": "냉동 컨테이너 통로 -> 적재 사무실 -> 백색 보관동 -> 야적장 출고문",
      "widgets": [
        "map_overlay",
        "freeze_meter",
        "evidence_balance"
      ],
      "data_sources": [
        "ch13.nodes",
        "player_flags"
      ],
      "primary_actions": [
        "select_node",
        "open_inventory"
      ],
      "notes": [
        "theme:white_yard_ethics"
      ]
    },
    {
      "screen_id": "CH13_EVENT",
      "screen_type": "event_dialogue",
      "title": "백색 야적장 이벤트",
      "purpose": "메인/사이드 선택과 텍스트 이벤트를 처리한다.",
      "widgets": [
        "event_card",
        "choice_list",
        "freeze_meter",
        "evidence_balance"
      ],
      "data_sources": [
        "ch13.events",
        "trust_state",
        "player_flags"
      ],
      "primary_actions": [
        "pick_choice",
        "back_to_map"
      ],
      "notes": [
        "stitch:동해 격리선"
      ]
    },
    {
      "screen_id": "CH13_LOOT",
      "screen_type": "loot_resolution",
      "title": "백색 야적장 루팅",
      "purpose": "사이드 퀘스트 결과와 보급 확보를 정산한다.",
      "widgets": [
        "loot_grid",
        "freeze_meter"
      ],
      "data_sources": [
        "loot_table",
        "player_inventory"
      ],
      "primary_actions": [
        "take_selected",
        "discard"
      ],
      "notes": []
    },
    {
      "screen_id": "CH13_BOSS_INTRO",
      "screen_type": "boss_intro",
      "title": "백색 견인체 등장",
      "purpose": "클라이맥스 전투 규칙과 비주얼 압박을 소개한다.",
      "widgets": [
        "boss_splash",
        "freeze_meter",
        "evidence_balance"
      ],
      "data_sources": [
        "boss_meta",
        "player_flags"
      ],
      "primary_actions": [
        "enter_boss"
      ],
      "notes": [
        "boss:white_yard_tower"
      ]
    },
    {
      "screen_id": "CH13_COMBAT",
      "screen_type": "combat_arena",
      "title": "백색 야적장 전투",
      "purpose": "보스전과 파트별 HUD 밀도를 반영한다.",
      "widgets": [
        "combat_hud",
        "boss_hp",
        "freeze_meter",
        "evidence_balance"
      ],
      "data_sources": [
        "combat_state",
        "enemy_state",
        "player_stats"
      ],
      "primary_actions": [
        "attack",
        "skill",
        "item",
        "move"
      ],
      "notes": []
    },
    {
      "screen_id": "CH13_RESULT",
      "screen_type": "result_summary",
      "title": "백색 야적장 결과",
      "purpose": "다음 장으로 밀려나는 결과와 Part 감정 잔향을 정리한다.",
      "widgets": [
        "chapter_result",
        "party_summary",
        "freeze_meter"
      ],
      "data_sources": [
        "chapter_outcome",
        "trust_state",
        "route_state"
      ],
      "primary_actions": [
        "confirm"
      ],
      "notes": [
        "immersion:동해 격리선"
      ]
    }
  ],
  "transitions": [
    {
      "from_screen_id": "CH13_BRIEF",
      "to_screen_id": "CH13_HUB",
      "trigger": "start_mission",
      "conditions": [],
      "notes": ""
    },
    {
      "from_screen_id": "CH13_HUB",
      "to_screen_id": "CH13_MAP",
      "trigger": "leave_safehouse",
      "conditions": [],
      "notes": "파트별 분위기 전용 허브 화면"
    },
    {
      "from_screen_id": "CH13_MAP",
      "to_screen_id": "CH13_EVENT",
      "trigger": "select_node",
      "conditions": [
        "node.has_event=true"
      ],
      "notes": ""
    },
    {
      "from_screen_id": "CH13_EVENT",
      "to_screen_id": "CH13_LOOT",
      "trigger": "choice_resolved",
      "conditions": [
        "event.grants_loot=true"
      ],
      "notes": ""
    },
    {
      "from_screen_id": "CH13_EVENT",
      "to_screen_id": "CH13_BOSS_INTRO",
      "trigger": "event_id=EV_CH13_BOSS",
      "conditions": [],
      "notes": ""
    },
    {
      "from_screen_id": "CH13_LOOT",
      "to_screen_id": "CH13_MAP",
      "trigger": "loot_closed",
      "conditions": [],
      "notes": ""
    },
    {
      "from_screen_id": "CH13_BOSS_INTRO",
      "to_screen_id": "CH13_COMBAT",
      "trigger": "enter_boss",
      "conditions": [],
      "notes": ""
    },
    {
      "from_screen_id": "CH13_COMBAT",
      "to_screen_id": "CH13_RESULT",
      "trigger": "combat_victory",
      "conditions": [
        "flag:chapter_13_completed"
      ],
      "notes": ""
    }
  ],
  "notes": [
    "part:P3",
    "visual:푸른 응급등, 백색 서리, 철골, 넓은 음영, 구조 기록 보드",
    "motion:주파수 스윕, 무거운 패널, 느린 페이드, 저온 브레스",
    "stitch_theme:white_yard_ethics"
  ]
}
