{
  "version": "1.0.0",
  "game_id": "dokdo_arc_webgame",
  "chapter_id": "CH15",
  "title": "Sealed Relay UI Flow",
  "entry_screen_id": "CH15_BRIEF",
  "screens": [
    {
      "screen_id": "CH15_BRIEF",
      "screen_type": "chapter_briefing",
      "title": "Sealed Relay briefing",
      "purpose": "Start the chapter",
      "widgets": [
        "objective_panel",
        "signal_decoder",
        "evidence_balance",
        "power_router"
      ],
      "data_sources": [
        "chapter_meta",
        "player_stats"
      ],
      "primary_actions": [
        "start_mission"
      ],
      "notes": [
        "target:7m"
      ]
    },
    {
      "screen_id": "CH15_HUB",
      "screen_type": "route_select",
      "title": "Sealed Relay hub",
      "purpose": "Expose chapter axis widgets",
      "widgets": [
        "signal_decoder",
        "evidence_balance",
        "power_router",
        "checkpoint_auth",
        "sacrifice_state",
        "field_actions_remaining"
      ],
      "data_sources": [
        "route_state",
        "player_flags",
        "player_stats"
      ],
      "primary_actions": [
        "confirm_route"
      ],
      "notes": []
    },
    {
      "screen_id": "CH15_MAP",
      "screen_type": "world_map",
      "title": "Sealed Relay graph",
      "purpose": "Show chapter graph and node progression",
      "widgets": [
        "map_overlay",
        "signal_decoder",
        "evidence_balance",
        "power_router"
      ],
      "data_sources": [
        "ch15.nodes",
        "player_flags"
      ],
      "primary_actions": [
        "select_node",
        "open_inventory"
      ],
      "notes": [
        "graph:Entry Gate -> Route Board -> Anchor Deck -> Field Window -> Terminal Gate"
      ]
    },
    {
      "screen_id": "CH15_EVENT",
      "screen_type": "event_dialogue",
      "title": "Sealed Relay events",
      "purpose": "Resolve branching events and side loops",
      "widgets": [
        "event_card",
        "choice_list",
        "signal_decoder",
        "evidence_balance",
        "power_router"
      ],
      "data_sources": [
        "ch15.events",
        "player_flags",
        "player_stats"
      ],
      "primary_actions": [
        "pick_choice",
        "back_to_map"
      ],
      "notes": [
        "field_actions:2",
        "repeatable:EV_CH15_SCAVENGE"
      ]
    },
    {
      "screen_id": "CH15_LOOT",
      "screen_type": "loot_resolution",
      "title": "Sealed Relay loot",
      "purpose": "Resolve scavenging and field rewards",
      "widgets": [
        "loot_grid",
        "signal_decoder"
      ],
      "data_sources": [
        "loot_table",
        "player_inventory"
      ],
      "primary_actions": [
        "take_selected",
        "discard"
      ],
      "notes": []
    },
    {
      "screen_id": "CH15_BOSS_INTRO",
      "screen_type": "boss_intro",
      "title": "Relay Judge intro",
      "purpose": "Summarize the final confrontation",
      "widgets": [
        "boss_splash",
        "boss_hp",
        "signal_decoder",
        "evidence_balance",
        "power_router"
      ],
      "data_sources": [
        "boss_meta",
        "player_stats"
      ],
      "primary_actions": [
        "enter_boss"
      ],
      "notes": [
        "boss:relay_judge"
      ]
    },
    {
      "screen_id": "CH15_COMBAT",
      "screen_type": "combat_arena",
      "title": "Sealed Relay combat",
      "purpose": "Run the boss combat HUD",
      "widgets": [
        "combat_hud",
        "boss_hp",
        "signal_decoder",
        "evidence_balance",
        "power_router"
      ],
      "data_sources": [
        "combat_state",
        "player_stats"
      ],
      "primary_actions": [
        "attack",
        "skill",
        "item",
        "move"
      ],
      "notes": []
    },
    {
      "screen_id": "CH15_RESULT",
      "screen_type": "result_summary",
      "title": "Sealed Relay result",
      "purpose": "Show closure or ending gate",
      "widgets": [
        "chapter_result",
        "ending_matrix",
        "signal_decoder",
        "evidence_balance"
      ],
      "data_sources": [
        "chapter_outcome",
        "player_flags",
        "player_stats"
      ],
      "primary_actions": [
        "confirm",
        "open_gallery"
      ],
      "notes": []
    },
    {
      "screen_id": "CH15_ENDINGS",
      "screen_type": "ending_gallery",
      "title": "Sealed Relay ending gallery",
      "purpose": "Show ending matrix, carry state, and demo route",
      "widgets": [
        "ending_gallery",
        "ending_matrix",
        "signal_decoder",
        "evidence_balance"
      ],
      "data_sources": [
        "unlocked_endings",
        "player_flags",
        "player_stats"
      ],
      "primary_actions": [
        "close_gallery",
        "confirm"
      ],
      "notes": [
        "ending_count:5"
      ]
    }
  ],
  "transitions": [
    {
      "from_screen_id": "CH15_BRIEF",
      "to_screen_id": "CH15_HUB",
      "trigger": "start_mission",
      "conditions": [],
      "notes": ""
    },
    {
      "from_screen_id": "CH15_HUB",
      "to_screen_id": "CH15_MAP",
      "trigger": "confirm_route",
      "conditions": [],
      "notes": ""
    },
    {
      "from_screen_id": "CH15_MAP",
      "to_screen_id": "CH15_EVENT",
      "trigger": "select_node",
      "conditions": [
        "node.has_event=true"
      ],
      "notes": ""
    },
    {
      "from_screen_id": "CH15_EVENT",
      "to_screen_id": "CH15_LOOT",
      "trigger": "choice_resolved",
      "conditions": [
        "event.grants_loot=true"
      ],
      "notes": ""
    },
    {
      "from_screen_id": "CH15_EVENT",
      "to_screen_id": "CH15_BOSS_INTRO",
      "trigger": "event_id=EV_CH15_BOSS",
      "conditions": [],
      "notes": ""
    },
    {
      "from_screen_id": "CH15_LOOT",
      "to_screen_id": "CH15_MAP",
      "trigger": "loot_closed",
      "conditions": [],
      "notes": ""
    },
    {
      "from_screen_id": "CH15_BOSS_INTRO",
      "to_screen_id": "CH15_COMBAT",
      "trigger": "enter_boss",
      "conditions": [],
      "notes": ""
    },
    {
      "from_screen_id": "CH15_COMBAT",
      "to_screen_id": "CH15_RESULT",
      "trigger": "combat_victory",
      "conditions": [
        "flag:ch15_boss_clear"
      ],
      "notes": ""
    },
    {
      "from_screen_id": "CH15_RESULT",
      "to_screen_id": "CH15_ENDINGS",
      "trigger": "open_gallery",
      "conditions": [],
      "notes": ""
    }
  ],
  "notes": [
    "part:P3",
    "carry:p3.route_access,p3.public_evidence,p3.medical_reserve,p3.power_margin,p3.sacrifice_load",
    "part:P?"
  ]
}
