{
  "version": "1.0.0",
  "game_id": "dokdo_arc_webgame",
  "chapter_id": "CH20",
  "title": "Dokdo Gate UI Flow",
  "entry_screen_id": "CH20_BRIEF",
  "screens": [
    {
      "screen_id": "CH20_BRIEF",
      "screen_type": "chapter_briefing",
      "title": "Dokdo Gate briefing",
      "purpose": "Start the chapter",
      "widgets": [
        "objective_panel",
        "public_queue",
        "broadcast_prep",
        "platform_vote"
      ],
      "data_sources": [
        "chapter_meta",
        "player_stats"
      ],
      "primary_actions": [
        "start_mission"
      ],
      "notes": [
        "target:9m"
      ]
    },
    {
      "screen_id": "CH20_HUB",
      "screen_type": "safehouse",
      "title": "Dokdo Gate hub",
      "purpose": "Expose chapter axis widgets",
      "widgets": [
        "public_queue",
        "broadcast_prep",
        "platform_vote",
        "core_state",
        "ending_matrix",
        "field_actions_remaining"
      ],
      "data_sources": [
        "route_state",
        "player_flags",
        "player_stats"
      ],
      "primary_actions": [
        "leave_safehouse"
      ],
      "notes": []
    },
    {
      "screen_id": "CH20_MAP",
      "screen_type": "world_map",
      "title": "Dokdo Gate graph",
      "purpose": "Show chapter graph and node progression",
      "widgets": [
        "map_overlay",
        "public_queue",
        "broadcast_prep",
        "platform_vote"
      ],
      "data_sources": [
        "ch20.nodes",
        "player_flags"
      ],
      "primary_actions": [
        "select_node",
        "open_inventory"
      ],
      "notes": [
        "graph:Entry Gate -> Route Board -> Anchor Deck -> Field Window -> Terminal Gate"
      ]
    },
    {
      "screen_id": "CH20_EVENT",
      "screen_type": "event_dialogue",
      "title": "Dokdo Gate events",
      "purpose": "Resolve branching events and side loops",
      "widgets": [
        "event_card",
        "choice_list",
        "public_queue",
        "broadcast_prep",
        "platform_vote"
      ],
      "data_sources": [
        "ch20.events",
        "player_flags",
        "player_stats"
      ],
      "primary_actions": [
        "pick_choice",
        "back_to_map"
      ],
      "notes": [
        "field_actions:2",
        "repeatable:EV_CH20_SCAVENGE"
      ]
    },
    {
      "screen_id": "CH20_LOOT",
      "screen_type": "loot_resolution",
      "title": "Dokdo Gate loot",
      "purpose": "Resolve scavenging and field rewards",
      "widgets": [
        "loot_grid",
        "public_queue"
      ],
      "data_sources": [
        "loot_table",
        "player_inventory"
      ],
      "primary_actions": [
        "take_selected",
        "discard"
      ],
      "notes": []
    },
    {
      "screen_id": "CH20_BOSS_INTRO",
      "screen_type": "boss_intro",
      "title": "Gate Executor intro",
      "purpose": "Summarize the final confrontation",
      "widgets": [
        "boss_splash",
        "boss_hp",
        "public_queue",
        "broadcast_prep",
        "platform_vote"
      ],
      "data_sources": [
        "boss_meta",
        "player_stats"
      ],
      "primary_actions": [
        "enter_boss"
      ],
      "notes": [
        "boss:gate_executor"
      ]
    },
    {
      "screen_id": "CH20_COMBAT",
      "screen_type": "combat_arena",
      "title": "Dokdo Gate combat",
      "purpose": "Run the boss combat HUD",
      "widgets": [
        "combat_hud",
        "boss_hp",
        "public_queue",
        "broadcast_prep",
        "platform_vote"
      ],
      "data_sources": [
        "combat_state",
        "player_stats"
      ],
      "primary_actions": [
        "attack",
        "skill",
        "item",
        "move"
      ],
      "notes": []
    },
    {
      "screen_id": "CH20_RESULT",
      "screen_type": "result_summary",
      "title": "Dokdo Gate result",
      "purpose": "Show closure or ending gate",
      "widgets": [
        "chapter_result",
        "ending_matrix",
        "public_queue",
        "broadcast_prep"
      ],
      "data_sources": [
        "chapter_outcome",
        "player_flags",
        "player_stats"
      ],
      "primary_actions": [
        "confirm",
        "open_gallery"
      ],
      "notes": []
    },
    {
      "screen_id": "CH20_ENDINGS",
      "screen_type": "ending_gallery",
      "title": "Dokdo Gate ending gallery",
      "purpose": "Show ending matrix, carry state, and demo route",
      "widgets": [
        "ending_gallery",
        "ending_matrix",
        "public_queue",
        "broadcast_prep"
      ],
      "data_sources": [
        "unlocked_endings",
        "player_flags",
        "player_stats"
      ],
      "primary_actions": [
        "close_gallery",
        "confirm"
      ],
      "notes": [
        "ending_count:3"
      ]
    }
  ],
  "transitions": [
    {
      "from_screen_id": "CH20_BRIEF",
      "to_screen_id": "CH20_HUB",
      "trigger": "start_mission",
      "conditions": [],
      "notes": ""
    },
    {
      "from_screen_id": "CH20_HUB",
      "to_screen_id": "CH20_MAP",
      "trigger": "leave_safehouse",
      "conditions": [],
      "notes": ""
    },
    {
      "from_screen_id": "CH20_MAP",
      "to_screen_id": "CH20_EVENT",
      "trigger": "select_node",
      "conditions": [
        "node.has_event=true"
      ],
      "notes": ""
    },
    {
      "from_screen_id": "CH20_EVENT",
      "to_screen_id": "CH20_LOOT",
      "trigger": "choice_resolved",
      "conditions": [
        "event.grants_loot=true"
      ],
      "notes": ""
    },
    {
      "from_screen_id": "CH20_EVENT",
      "to_screen_id": "CH20_BOSS_INTRO",
      "trigger": "event_id=EV_CH20_BOSS",
      "conditions": [],
      "notes": ""
    },
    {
      "from_screen_id": "CH20_LOOT",
      "to_screen_id": "CH20_MAP",
      "trigger": "loot_closed",
      "conditions": [],
      "notes": ""
    },
    {
      "from_screen_id": "CH20_BOSS_INTRO",
      "to_screen_id": "CH20_COMBAT",
      "trigger": "enter_boss",
      "conditions": [],
      "notes": ""
    },
    {
      "from_screen_id": "CH20_COMBAT",
      "to_screen_id": "CH20_RESULT",
      "trigger": "combat_victory",
      "conditions": [
        "flag:ch20_boss_clear"
      ],
      "notes": ""
    },
    {
      "from_screen_id": "CH20_RESULT",
      "to_screen_id": "CH20_ENDINGS",
      "trigger": "open_gallery",
      "conditions": [],
      "notes": ""
    }
  ],
  "notes": [
    "part:P4",
    "carry:order_score,witness_score,solidarity_score,public_support,broadcast_ready,capacity_pressure",
    "part:P?"
  ]
}
