{
  "version": "1.0.0",
  "game_id": "dokdo_arc_webgame",
  "chapter_id": "CH08",
  "title": "Midnight Market UI Flow",
  "entry_screen_id": "CH08_BRIEF",
  "screens": [
    {
      "screen_id": "CH08_BRIEF",
      "screen_type": "chapter_briefing",
      "title": "Midnight Market briefing",
      "purpose": "Start the chapter",
      "widgets": [
        "objective_panel",
        "queue_pressure",
        "pursuit_meter",
        "stamp_auth"
      ],
      "data_sources": [
        "chapter_meta",
        "player_stats"
      ],
      "primary_actions": [
        "start_mission"
      ],
      "notes": [
        "target:6m"
      ]
    },
    {
      "screen_id": "CH08_HUB",
      "screen_type": "route_select",
      "title": "Midnight Market hub",
      "purpose": "Expose chapter axis widgets",
      "widgets": [
        "queue_pressure",
        "pursuit_meter",
        "stamp_auth",
        "smoke_density",
        "boarding_capacity",
        "field_actions_remaining"
      ],
      "data_sources": [
        "route_state",
        "player_flags",
        "player_stats"
      ],
      "primary_actions": [
        "confirm_route"
      ],
      "notes": []
    },
    {
      "screen_id": "CH08_MAP",
      "screen_type": "world_map",
      "title": "Midnight Market graph",
      "purpose": "Show chapter graph and node progression",
      "widgets": [
        "map_overlay",
        "queue_pressure",
        "pursuit_meter",
        "stamp_auth"
      ],
      "data_sources": [
        "ch08.nodes",
        "player_flags"
      ],
      "primary_actions": [
        "select_node",
        "open_inventory"
      ],
      "notes": [
        "graph:Entry Gate -> Route Board -> Anchor Deck -> Field Window -> Terminal Gate"
      ]
    },
    {
      "screen_id": "CH08_EVENT",
      "screen_type": "event_dialogue",
      "title": "Midnight Market events",
      "purpose": "Resolve branching events and side loops",
      "widgets": [
        "event_card",
        "choice_list",
        "queue_pressure",
        "pursuit_meter",
        "stamp_auth"
      ],
      "data_sources": [
        "ch08.events",
        "player_flags",
        "player_stats"
      ],
      "primary_actions": [
        "pick_choice",
        "back_to_map"
      ],
      "notes": [
        "field_actions:2",
        "repeatable:EV_CH08_SCAVENGE"
      ]
    },
    {
      "screen_id": "CH08_LOOT",
      "screen_type": "loot_resolution",
      "title": "Midnight Market loot",
      "purpose": "Resolve scavenging and field rewards",
      "widgets": [
        "loot_grid",
        "queue_pressure"
      ],
      "data_sources": [
        "loot_table",
        "player_inventory"
      ],
      "primary_actions": [
        "take_selected",
        "discard"
      ],
      "notes": []
    },
    {
      "screen_id": "CH08_BOSS_INTRO",
      "screen_type": "boss_intro",
      "title": "Broker Enforcer intro",
      "purpose": "Summarize the final confrontation",
      "widgets": [
        "boss_splash",
        "boss_hp",
        "queue_pressure",
        "pursuit_meter",
        "stamp_auth"
      ],
      "data_sources": [
        "boss_meta",
        "player_stats"
      ],
      "primary_actions": [
        "enter_boss"
      ],
      "notes": [
        "boss:broker_enforcer"
      ]
    },
    {
      "screen_id": "CH08_COMBAT",
      "screen_type": "combat_arena",
      "title": "Midnight Market combat",
      "purpose": "Run the boss combat HUD",
      "widgets": [
        "combat_hud",
        "boss_hp",
        "queue_pressure",
        "pursuit_meter",
        "stamp_auth"
      ],
      "data_sources": [
        "combat_state",
        "player_stats"
      ],
      "primary_actions": [
        "attack",
        "skill",
        "item",
        "move"
      ],
      "notes": []
    },
    {
      "screen_id": "CH08_RESULT",
      "screen_type": "result_summary",
      "title": "Midnight Market result",
      "purpose": "Show closure or ending gate",
      "widgets": [
        "chapter_result",
        "queue_pressure",
        "pursuit_meter"
      ],
      "data_sources": [
        "chapter_outcome",
        "player_flags",
        "player_stats"
      ],
      "primary_actions": [
        "confirm",
        "open_gallery"
      ],
      "notes": []
    },
    {
      "screen_id": "CH08_ENDINGS",
      "screen_type": "ending_gallery",
      "title": "Midnight Market ending gallery",
      "purpose": "Show ending matrix, carry state, and demo route",
      "widgets": [
        "ending_gallery",
        "chapter_result",
        "queue_pressure",
        "pursuit_meter"
      ],
      "data_sources": [
        "unlocked_endings",
        "player_flags",
        "player_stats"
      ],
      "primary_actions": [
        "close_gallery",
        "confirm"
      ],
      "notes": [
        "ending_count:0"
      ]
    }
  ],
  "transitions": [
    {
      "from_screen_id": "CH08_BRIEF",
      "to_screen_id": "CH08_HUB",
      "trigger": "start_mission",
      "conditions": [],
      "notes": ""
    },
    {
      "from_screen_id": "CH08_HUB",
      "to_screen_id": "CH08_MAP",
      "trigger": "confirm_route",
      "conditions": [],
      "notes": ""
    },
    {
      "from_screen_id": "CH08_MAP",
      "to_screen_id": "CH08_EVENT",
      "trigger": "select_node",
      "conditions": [
        "node.has_event=true"
      ],
      "notes": ""
    },
    {
      "from_screen_id": "CH08_EVENT",
      "to_screen_id": "CH08_LOOT",
      "trigger": "choice_resolved",
      "conditions": [
        "event.grants_loot=true"
      ],
      "notes": ""
    },
    {
      "from_screen_id": "CH08_EVENT",
      "to_screen_id": "CH08_BOSS_INTRO",
      "trigger": "event_id=EV_CH08_BOSS",
      "conditions": [],
      "notes": ""
    },
    {
      "from_screen_id": "CH08_LOOT",
      "to_screen_id": "CH08_MAP",
      "trigger": "loot_closed",
      "conditions": [],
      "notes": ""
    },
    {
      "from_screen_id": "CH08_BOSS_INTRO",
      "to_screen_id": "CH08_COMBAT",
      "trigger": "enter_boss",
      "conditions": [],
      "notes": ""
    },
    {
      "from_screen_id": "CH08_COMBAT",
      "to_screen_id": "CH08_RESULT",
      "trigger": "combat_victory",
      "conditions": [
        "flag:ch08_boss_clear"
      ],
      "notes": ""
    },
    {
      "from_screen_id": "CH08_RESULT",
      "to_screen_id": "CH08_ENDINGS",
      "trigger": "open_gallery",
      "conditions": [],
      "notes": ""
    }
  ],
  "notes": [
    "part:P2",
    "carry:official_lane,broker_lane,witness_chain,capacity_ethics,harbor_force",
    "part:P?"
  ]
}
