{   "version": "1.0.0",   "game_id": "dokdo_arc_webgame",   "chapter_id": "CH02",   "title": "검은 수로 UI 플로우",   "entry_screen_id": "CH02_BRIEF",   "screens": [     {       "screen_id": "CH02_BRIEF",       "screen_type": "chapter_briefing",       "title": "수로 원정 브리핑",       "purpose": "중계배터리와 수로 지도를 목표로 보여준다.",       "widgets": [         "objective_panel",         "recommended_gear",         "water_warning"       ],       "data_sources": [         "chapter_meta",         "player_inventory"       ],       "primary_actions": [         "start_mission"       ],       "notes": []     },     {       "screen_id": "CH02_MAP",       "screen_type": "world_map",       "title": "수몰권 지도",       "purpose": "수심, 수로, 오염 구역을 오버레이로 표시한다.",       "widgets": [         "node_map",         "water_depth",         "contamination_meter",         "route_hint"       ],       "data_sources": [         "ch02.nodes",         "route_state",         "player_stats"       ],       "primary_actions": [         "select_node",         "toggle_water_overlay",         "open_inventory"       ],       "notes": []     },     {       "screen_id": "CH02_EVENT",       "screen_type": "event_dialogue",       "title": "수몰 이벤트",       "purpose": "물 위/물 아래 상호작용과 거래를 처리한다.",       "widgets": [         "event_card",         "choice_list",         "water_depth",         "npc_portrait"       ],       "data_sources": [         "ch02.events",         "player_items",         "player_flags"       ],       "primary_actions": [         "pick_choice",         "back_to_map"       ],       "notes": []     },     {       "screen_id": "CH02_MARKET",       "screen_type": "safehouse",       "title": "암시장/선착장",       "purpose": "정노아 거래와 서진서 보트 협상을 처리한다.",       "widgets": [         "trade_panel",         "reputation_change",         "route_compare"       ],       "data_sources": [         "npc_jung_noah",         "npc_seo_jinseo",         "player_inventory"       ],       "primary_actions": [         "trade",         "rent_boat",         "leave"       ],       "notes": []     },     {       "screen_id": "CH02_LOOT",       "screen_type": "loot_resolution",       "title": "수몰 루팅",       "purpose": "젖은 아이템과 오염 페널티를 포함한 루팅 UI.",       "widgets": [         "loot_grid",         "capacity_meter",         "wet_item_badge"       ],       "data_sources": [         "loot_table",         "player_inventory"       ],       "primary_actions": [         "take_selected",         "discard",         "sanitize"       ],       "notes": []     },     {       "screen_id": "CH02_BOSS_INTRO",       "screen_type": "boss_intro",       "title": "배수문 제어실",       "purpose": "수문 개폐와 보스 기믹을 설명한다.",       "widgets": [         "boss_splash",         "water_level",         "boss_hint"       ],       "data_sources": [         "boss_meta",         "route_state"       ],       "primary_actions": [         "enter_boss"       ],       "notes": []     },     {       "screen_id": "CH02_COMBAT",       "screen_type": "combat_arena",       "title": "청음 전투",       "purpose": "수위 변화와 포자 폭발을 관리하는 전투 UI.",       "widgets": [         "combat_hud",         "boss_hp",         "water_level",         "contamination_meter"       ],       "data_sources": [         "combat_state",         "player_stats",         "enemy_state"       ],       "primary_actions": [         "attack",         "skill",         "item",         "move"       ],       "notes": []     },     {       "screen_id": "CH02_RESULT",       "screen_type": "result_summary",       "title": "수로 정산",       "purpose": "개폐 선택과 평판 변화를 결과로 노출한다.",       "widgets": [         "chapter_result",         "route_summary",         "reputation_change"       ],       "data_sources": [         "chapter_outcome",         "route_state",         "trust_state"       ],       "primary_actions": [         "confirm"       ],       "notes": []     }   ],   "transitions": [     {       "from_screen_id": "CH02_BRIEF",       "to_screen_id": "CH02_MAP",       "trigger": "start_mission",       "conditions": [],       "notes": ""     },     {       "from_screen_id": "CH02_MAP",       "to_screen_id": "CH02_EVENT",       "trigger": "select_node",       "conditions": [         "node.has_event=true"       ],       "notes": ""     },     {       "from_screen_id": "CH02_EVENT",       "to_screen_id": "CH02_MARKET",       "trigger": "event_id in [EV_CH02_BLACKMARKET, EV_CH02_PIER_BARGAIN]",       "conditions": [],       "notes": "거래형 이벤트 전용 화면"     },     {       "from_screen_id": "CH02_EVENT",       "to_screen_id": "CH02_LOOT",       "trigger": "choice_resolved",       "conditions": [         "event.grants_loot=true"       ],       "notes": ""     },     {       "from_screen_id": "CH02_EVENT",       "to_screen_id": "CH02_BOSS_INTRO",       "trigger": "event_id=EV_CH02_SLUICE_BOSS",       "conditions": [],       "notes": ""     },     {       "from_screen_id": "CH02_MARKET",       "to_screen_id": "CH02_EVENT",       "trigger": "leave_market",       "conditions": [],       "notes": ""     },     {       "from_screen_id": "CH02_LOOT",       "to_screen_id": "CH02_MAP",       "trigger": "loot_closed",       "conditions": [],       "notes": ""     },     {       "from_screen_id": "CH02_BOSS_INTRO",       "to_screen_id": "CH02_COMBAT",       "trigger": "enter_boss",       "conditions": [],       "notes": ""     },     {       "from_screen_id": "CH02_COMBAT",       "to_screen_id": "CH02_RESULT",       "trigger": "combat_victory",       "conditions": [         "flag:chapter_02_escape_ready"       ],       "notes": ""     },     {       "from_screen_id": "CH02_MAP",       "to_screen_id": "CH02_RESULT",       "trigger": "event_id=EV_CH02_EXTRACTION",       "conditions": [         "flag:chapter_02_completed"       ],       "notes": ""     }   ],   "notes": [     "CH02부터 튜토리얼 툴팁은 축소하고 수심/오염 오버레이를 핵심 시각언어로 쓴다.",     "암시장 UI는 일반 상점이 아니라 평판 기반 잠금/할증 구조를 전제로 설계한다."   ] }